cao_code,name,description,nfq_level,duration,tags,course_url,college_id,points,entry_requirements,career_info,created_at,source_page,keywords
,Avanti Language Institute,,8,,General,https://www.qualifax.ie/providers/avanti-language-institute,1,0,,,2025-01-25T15:00:00,46,"avanti, general, institute, language"
,AWS Cloud Architecture,,8,,General,https://www.qualifax.ie/course/219693,1,0,,,2025-01-25T15:00:00,47,"architecture, aws, cloud, general"
,"Backup Plans to your 1st Choice - CAO, PLC  - Webinar",,8,,General,https://www.qualifax.ie/events/backup-plans-to-your-1st-choice-cao-plc-webinar-0,1,0,,,2025-01-25T15:00:00,47,"1st, backup, cao, choice, general, plans, plc, webinar, your"
,Bacteriology - Structured,,8,,General,https://www.qualifax.ie/course/82050,1,0,,,2025-01-25T15:00:00,47,"bacteriology, general, structured"
,Ballina Digital Skills Centre,,8,,General,https://www.qualifax.ie/providers/ballina-digital-skills-centre,1,0,,,2025-01-25T15:00:00,48,"ballina, centre, digital, general, skills"
,Ballincollig Community School,,8,,General,https://www.qualifax.ie/providers/ballincollig-community-school,1,0,,,2025-01-25T15:00:00,48,"ballincollig, community, general, school"
,Ballyfermot Contracted,,8,,General,https://www.qualifax.ie/providers/ballyfermot-contracted,1,0,,,2025-01-25T15:00:00,48,"ballyfermot, contracted, general"
,Ballyhaise Agricultural College,,8,,General,https://www.qualifax.ie/providers/ballyhaise-agricultural-college,1,0,,,2025-01-25T15:00:00,48,"agricultural, ballyhaise, college, general"
,Ballyshannon AETC,,8,,General,https://www.qualifax.ie/providers/ballyshannon-aetc,1,0,,,2025-01-25T15:00:00,48,"aetc, ballyshannon, general"
,Banking,,8,,General,https://www.qualifax.ie/course/93814,1,0,,,2025-01-25T15:00:00,48,"banking, general"
,Banking & Financial Services,,8,,General,https://www.qualifax.ie/course/108445,1,0,,,2025-01-25T15:00:00,48,"banking, financial, general, services"
,Barbering,,8,,General,https://www.qualifax.ie/course/101935,1,0,,,2025-01-25T15:00:00,48,"barbering, general"
,Barbering - Introduction,,8,,General,https://www.qualifax.ie/course/72032,1,0,,,2025-01-25T15:00:00,48,"barbering, general, introduction"
,Barbering Basics,,8,,General,https://www.qualifax.ie/course/85498,1,0,,,2025-01-25T15:00:00,48,"barbering, basics, general"
,Barbering Techniques,,8,,General,https://www.qualifax.ie/course/79184,1,0,,,2025-01-25T15:00:00,48,"barbering, general, techniques"
,Barista Skills (Skills to Advance),,8,,General,https://www.qualifax.ie/course/112061,1,0,,,2025-01-25T15:00:00,48,"advance, barista, general, skills"
,Barista Training,,8,,General,https://www.qualifax.ie/course/115502,1,0,,,2025-01-25T15:00:00,48,"barista, general, training"
,Barrow Training & Consultancy,,8,,General,https://www.qualifax.ie/providers/barrow-training-consultancy,1,0,,,2025-01-25T15:00:00,48,"barrow, consultancy, general, training"
,Basic Life Support (BLS),,8,,General,https://www.qualifax.ie/course/220413,1,0,,,2025-01-25T15:00:00,48,"basic, bls, general, life, support"
,Basic Skills by Phone or Online,,8,,General,https://www.qualifax.ie/course/219107,1,0,,,2025-01-25T15:00:00,49,"basic, general, online, phone, skills"
,Basic Techniques in Drawing & Painting - Summer 2025,,8,,General,https://www.qualifax.ie/course/219320,1,0,,,2025-01-25T15:00:00,49,"2025, basic, drawing, general, painting, summer, techniques"
,Beacon Training,,8,,General,https://www.qualifax.ie/providers/beacon-training,1,0,,,2025-01-25T15:00:00,49,"beacon, general, training"
,Beannachta na Nollag  Qualifax  Seasons Greetings from Qualifax,,8,,General,https://www.qualifax.ie/news/beannachtai-na-nollag-o-qualifax-seasons-greetings-from-qualifax,1,0,,,2025-01-25T15:00:00,49,"beannachta, from, general, greetings, nollag, qualifax, seasons"
,Beaufort College,,8,,General,https://www.qualifax.ie/providers/beaufort-college,1,0,,,2025-01-25T15:00:00,49,"beaufort, college, general"
,Beauty - Eyelash Extensions,,8,,General,https://www.qualifax.ie/course/221701,1,0,,,2025-01-25T15:00:00,49,"beauty, extensions, eyelash, general"
,Beauty - Filler Foundation,,8,,General,https://www.qualifax.ie/course/223329,1,0,,,2025-01-25T15:00:00,49,"beauty, filler, foundation, general"
,Beauty - Manicure & Pedicure,,8,,General,https://www.qualifax.ie/course/221719,1,0,,,2025-01-25T15:00:00,49,"beauty, general, manicure, pedicure"
,Beauty & Retail Sales Year 1,,8,,General,https://www.qualifax.ie/course/2062,1,0,,,2025-01-25T15:00:00,49,"beauty, general, retail, sales, year"
,Beauty & Spa Therapist,,8,,General,https://www.qualifax.ie/course/11369,1,0,,,2025-01-25T15:00:00,49,"beauty, general, spa, therapist"
,Beauty Advanced - Senior Therapist,,8,,General,https://www.qualifax.ie/course/76723,1,0,,,2025-01-25T15:00:00,49,"advanced, beauty, general, senior, therapist"
,Beauty Aesthetics & Body Treatments - Advanced,,8,,General,https://www.qualifax.ie/course/101999,1,0,,,2025-01-25T15:00:00,49,"advanced, aesthetics, beauty, body, general, treatments"
,Beauty Consultancy,,8,,General,https://www.qualifax.ie/course/111720,1,0,,,2025-01-25T15:00:00,49,"beauty, consultancy, general"
,Beauty Specialist,,8,,General,https://www.qualifax.ie/course/104960,1,0,,,2025-01-25T15:00:00,49,"beauty, general, specialist"
,Beauty Specialist & Retail Sales - Year 2,,8,,General,https://www.qualifax.ie/course/99254,1,0,,,2025-01-25T15:00:00,49,"beauty, general, retail, sales, specialist, year"
,Beauty Specialists,,8,,General,https://www.qualifax.ie/course/111722,1,0,,,2025-01-25T15:00:00,49,"beauty, general, specialists"
,Beauty Therapies - Advanced,,8,,General,https://www.qualifax.ie/course/218924,1,0,,,2025-01-25T15:00:00,49,"advanced, beauty, general, therapies"
,Behaviour Analysis - Applied,,8,,General,https://www.qualifax.ie/course/26502,1,0,,,2025-01-25T15:00:00,51,"analysis, applied, behaviour, general"
,Belfast Metropolitan College - Castlereagh Campus,,8,,General,https://www.qualifax.ie/providers/belfast-metropolitan-college-castlereagh-campus,1,0,,,2025-01-25T15:00:00,51,"belfast, campus, castlereagh, college, general, metropolitan"
,Belfast Metropolitan College - e3 Campus,,8,,General,https://www.qualifax.ie/providers/belfast-metropolitan-college-e3-campus,1,0,,,2025-01-25T15:00:00,51,"belfast, campus, college, general, metropolitan"
,Belfast Metropolitan College - Millfield Campus,,8,,General,https://www.qualifax.ie/providers/belfast-metropolitan-college-millfield-campus,1,0,,,2025-01-25T15:00:00,52,"belfast, campus, college, general, metropolitan, millfield"
,BeLonG To,,8,,General,https://www.qualifax.ie/providers/belong-to,1,0,,,2025-01-25T15:00:00,52,"belong, general"
,BER Course - Domestic Building Energy Rating Assessment,,8,,General,https://www.qualifax.ie/course/94745,1,0,,,2025-01-25T15:00:00,52,"assessment, ber, building, domestic, energy, general, rating"
,BER Course - Non Domestic,,8,,General,https://www.qualifax.ie/course/111222,1,0,,,2025-01-25T15:00:00,52,"ber, domestic, general, non"
,Bereavement - Grief & Loss,,8,,General,https://www.qualifax.ie/course/116240,1,0,,,2025-01-25T15:00:00,52,"bereavement, general, grief, loss"
,Bereavement & Loss - Children & Loss,,8,,General,https://www.qualifax.ie/course/76541,1,0,,,2025-01-25T15:00:00,52,"bereavement, children, general, loss"
,Bereavement & Loss in Midwifery Practice,,8,,General,https://www.qualifax.ie/course/116239,1,0,,,2025-01-25T15:00:00,52,"bereavement, general, loss, midwifery, practice"
,Bereavement Events,,8,,General,https://www.qualifax.ie/course/219429,1,0,,,2025-01-25T15:00:00,52,"bereavement, events, general"
,Bereavement Workshops,,8,,General,https://www.qualifax.ie/course/116249,1,0,,,2025-01-25T15:00:00,52,"bereavement, general, workshops"
,Berlitz Dublin,,8,,General,https://www.qualifax.ie/providers/berlitz-dublin,1,0,,,2025-01-25T15:00:00,52,"berlitz, dublin, general"
,Better Options 2025 - AHEADs Annual College Information Event,,8,,General,https://www.qualifax.ie/events/better-options-2025-aheads-annual-college-information-event,1,0,,,2025-01-25T15:00:00,52,"2025, aheads, annual, better, college, event, general, information, options"
,Bhainistocht agus Gn Digiteach,,8,,General,https://www.qualifax.ie/course/98791,1,0,,,2025-01-25T15:00:00,52,"agus, bhainistocht, digiteach, general, gn"
,Bicycle Technician - Stage 1 - Blended Learning,,8,,General,https://www.qualifax.ie/course/218613,1,0,,,2025-01-25T15:00:00,52,"bicycle, blended, general, learning, stage, technician"
,BIM - Digital Construction - Bolton Street,,8,,General,https://www.qualifax.ie/course/26766,1,0,,,2025-01-25T15:00:00,52,"bim, bolton, construction, digital, general, street"
,BIM - Using Revit - Introduction,,8,,General,https://www.qualifax.ie/course/112923,1,0,,,2025-01-25T15:00:00,52,"bim, general, introduction, revit, using"
,BIM & BIM Collaboration - Advanced,,8,,General,https://www.qualifax.ie/course/112925,1,0,,,2025-01-25T15:00:00,52,"advanced, bim, collaboration, general"
,BIMM Dublin Open Day (Sat),,8,,General,https://www.qualifax.ie/events/bimm-dublin-open-day-sat-8,1,0,,,2025-01-25T15:00:00,52,"bimm, day, dublin, general, open, sat"
,BIMM Institute Dublin,,8,,General,https://www.qualifax.ie/providers/bimm-institute-dublin,1,0,,,2025-01-25T15:00:00,53,"bimm, dublin, general, institute"
,Bioanalysis - Tallaght,,8,,General,https://www.qualifax.ie/course/13360,1,0,,,2025-01-25T15:00:00,53,"bioanalysis, general, tallaght"
,Bioanalytical Techniques - Sligo,,8,,General,https://www.qualifax.ie/course/108245,1,0,,,2025-01-25T15:00:00,53,"bioanalytical, general, sligo, techniques"
,Biodiversity & Conservation,,8,,General,https://www.qualifax.ie/course/26675,1,0,,,2025-01-25T15:00:00,53,"biodiversity, conservation, general"
,Biodiversity & Land-Use Planning,,8,,General,https://www.qualifax.ie/course/83560,1,0,,,2025-01-25T15:00:00,53,"biodiversity, general, land, planning, use"
,Biodiversity & the Natural Environment,,8,,General,https://www.qualifax.ie/course/110551,1,0,,,2025-01-25T15:00:00,53,"biodiversity, environment, general, natural"
,Bioindustry 4.0 - Sligo,,8,,General,https://www.qualifax.ie/course/221862,1,0,,,2025-01-25T15:00:00,53,"bioindustry, general, sligo"
,Bioinformatics - Letterkenny,,8,,General,https://www.qualifax.ie/course/221863,1,0,,,2025-01-25T15:00:00,53,"bioinformatics, general, letterkenny"
,Bioinformatics - Research,,8,,General,https://www.qualifax.ie/course/55341,1,0,,,2025-01-25T15:00:00,53,"bioinformatics, general, research"
,Bioinformatics - Structured,,8,,General,https://www.qualifax.ie/course/59632,1,0,,,2025-01-25T15:00:00,53,"bioinformatics, general, structured"
,Bioinformatics & Computational Genomics,,8,,General,https://www.qualifax.ie/course/89571,1,0,,,2025-01-25T15:00:00,54,"bioinformatics, computational, general, genomics"
,Bioinnovation,,8,,General,https://www.qualifax.ie/course/112611,1,0,,,2025-01-25T15:00:00,54,"bioinnovation, general"
,Bioinnovation - Research,,8,,General,https://www.qualifax.ie/course/98726,1,0,,,2025-01-25T15:00:00,54,"bioinnovation, general, research"
,Biological & Environmental Studies - Kerry,,8,,General,https://www.qualifax.ie/course/28369,1,0,,,2025-01-25T15:00:00,54,"biological, environmental, general, kerry, studies"
,Biological Diversity,,8,,General,https://www.qualifax.ie/course/220618,1,0,,,2025-01-25T15:00:00,54,"biological, diversity, general"
,BioPharma - Laboratory Analyst - Apprenticeship,,9,,General,https://www.qualifax.ie/course/219350,1,0,,,2025-01-25T15:00:00,56,"analyst, apprenticeship, biopharma, general, laboratory"
,Biopharma - Laboratory Technician - Apprenticeship,,9,,General,https://www.qualifax.ie/course/219346,1,0,,,2025-01-25T15:00:00,56,"apprenticeship, biopharma, general, laboratory, technician"
,Biopharmaceutical Manufacturing,,8,,General,https://www.qualifax.ie/course/114126,1,0,,,2025-01-25T15:00:00,56,"biopharmaceutical, general, manufacturing"
,Biopharmaceutical Manufacturing - Galway,,8,,General,https://www.qualifax.ie/course/112904,1,0,,,2025-01-25T15:00:00,56,"biopharmaceutical, galway, general, manufacturing"
,Biopharmaceutical Operations - Extended Campus,,8,,General,https://www.qualifax.ie/course/113884,1,0,,,2025-01-25T15:00:00,56,"biopharmaceutical, campus, extended, general, operations"
,Biopharmaceutical Processing - Sligo,,8,,General,https://www.qualifax.ie/course/83303,1,0,,,2025-01-25T15:00:00,56,"biopharmaceutical, general, processing, sligo"
,BioPharmaceutical Validation & Digitalisation - Sligo,,8,,General,https://www.qualifax.ie/course/221871,1,0,,,2025-01-25T15:00:00,57,"biopharmaceutical, digitalisation, general, sligo, validation"
,Bioprocessing,,8,,General,https://www.qualifax.ie/course/110191,1,0,,,2025-01-25T15:00:00,57,"bioprocessing, general"
,Bioprocessing Technologies - Sligo,,8,,General,https://www.qualifax.ie/course/104853,1,0,,,2025-01-25T15:00:00,57,"bioprocessing, general, sligo, technologies"
,Biostatistics,,8,,General,https://www.qualifax.ie/course/98857,1,0,,,2025-01-25T15:00:00,57,"biostatistics, general"
,Biostatistics - Research,,8,,General,https://www.qualifax.ie/course/55342,1,0,,,2025-01-25T15:00:00,57,"biostatistics, general, research"
,Biostatistics - Structured,,8,,General,https://www.qualifax.ie/course/59634,1,0,,,2025-01-25T15:00:00,57,"biostatistics, general, structured"
,Biotherapeutics,,8,,General,https://www.qualifax.ie/course/218480,1,0,,,2025-01-25T15:00:00,58,"biotherapeutics, general"
,Bishopstown Community School,,8,,General,https://www.qualifax.ie/providers/bishopstown-community-school,1,0,,,2025-01-25T15:00:00,58,"bishopstown, community, general, school"
,Blackrock FEI Open Day,,8,,General,https://www.qualifax.ie/events/blackrock-fei-open-day-0,1,0,,,2025-01-25T15:00:00,58,"blackrock, day, fei, general, open"
,Block Based Mobile Applications Development for Educators - Letterkenny,,8,,General,https://www.qualifax.ie/course/222455,1,0,,,2025-01-25T15:00:00,58,"applications, based, block, development, educators, general, letterkenny, mobile"
,Blockchain for Managers - Galway,,8,,General,https://www.qualifax.ie/course/221829,1,0,,,2025-01-25T15:00:00,58,"blockchain, galway, general, managers"
,Blockchain Technologies & Applications - Letterkenny,,8,,General,https://www.qualifax.ie/course/115204,1,0,,,2025-01-25T15:00:00,58,"applications, blockchain, general, letterkenny, technologies"
,Body Treatments,,8,,General,https://www.qualifax.ie/course/111723,1,0,,,2025-01-25T15:00:00,58,"body, general, treatments"
,Bookkeeping,,8,,General,https://www.qualifax.ie/course/222321,1,0,,,2025-01-25T15:00:00,58,"bookkeeping, general"
,Bookkeeping - Sage for Windows,,8,,General,https://www.qualifax.ie/course/9705,1,0,,,2025-01-25T15:00:00,59,"bookkeeping, general, sage, windows"
,Boom Sprayer Pesticide Application,,8,,General,https://www.qualifax.ie/course/68563,1,0,,,2025-01-25T15:00:00,59,"application, boom, general, pesticide, sprayer"
,Bord Iascaigh Mhara,,8,,General,https://www.qualifax.ie/providers/bord-iascaigh-mhara,1,0,,,2025-01-25T15:00:00,59,"bord, general, iascaigh, mhara"
,Botanical Cuisine - Advanced Entry - Tallaght,,8,,General,https://www.qualifax.ie/course/221727,1,0,,,2025-01-25T15:00:00,59,"advanced, botanical, cuisine, entry, general, tallaght"
,Botanical Cuisine - Tallaght,,8,,General,https://www.qualifax.ie/course/103416,1,0,,,2025-01-25T15:00:00,59,"botanical, cuisine, general, tallaght"
,Botany - Structured,,8,,General,https://www.qualifax.ie/course/59636,1,0,,,2025-01-25T15:00:00,59,"botany, general, structured"
,Boyne Community School,,8,,General,https://www.qualifax.ie/providers/boyne-community-school,1,0,,,2025-01-25T15:00:00,59,"boyne, community, general, school"
,Bray Institute of FE Open Evening,,8,,General,https://www.qualifax.ie/events/bray-institute-of-fe-open-evening-5,1,0,,,2025-01-25T15:00:00,59,"bray, evening, general, institute, open"
,Bray Institute of FE Open Night,,8,,General,https://www.qualifax.ie/events/bray-institute-of-fe-open-night-1,1,0,,,2025-01-25T15:00:00,59,"bray, general, institute, night, open"
,Bread Pastry & Desserts - Thurles,,8,,General,https://www.qualifax.ie/course/223575,1,0,,,2025-01-25T15:00:00,60,"bread, desserts, general, pastry, thurles"
,Breaking Bad News,,8,,General,https://www.qualifax.ie/course/223545,1,0,,,2025-01-25T15:00:00,60,"bad, breaking, general, news"
,Breaking Bad News with Simulated Practice,,8,,General,https://www.qualifax.ie/course/223546,1,0,,,2025-01-25T15:00:00,60,"bad, breaking, general, news, practice, simulated"
,Breifne College,,8,,General,https://www.qualifax.ie/providers/breifne-college,1,0,,,2025-01-25T15:00:00,60,"breifne, college, general"
,Brewing & Distilling - Carlow,,8,,General,https://www.qualifax.ie/course/103687,1,0,,,2025-01-25T15:00:00,60,"brewing, carlow, distilling, general"
,Brewing & Distilling - Conversion Course - Grangegorman,,8,,General,https://www.qualifax.ie/course/218879,1,0,,,2025-01-25T15:00:00,60,"brewing, conversion, distilling, general, grangegorman"
,Brewing & Distilling - Grangegorman,,8,,General,https://www.qualifax.ie/course/222044,1,0,,,2025-01-25T15:00:00,60,"brewing, distilling, general, grangegorman"
,Brewing & Distilling - Micro-credential,,8,,General,https://www.qualifax.ie/course/113906,1,0,,,2025-01-25T15:00:00,60,"brewing, credential, distilling, general, micro"
,Brick & Block Laying,,8,,General,https://www.qualifax.ie/course/68545,1,0,,,2025-01-25T15:00:00,60,"block, brick, general, laying"
,Bridge Mills Galway Language Centre Ltd,,8,,General,https://www.qualifax.ie/providers/bridge-mills-galway-language-centre-ltd,1,0,,,2025-01-25T15:00:00,60,"bridge, centre, galway, general, language, ltd, mills"
,Broadcast Production Skills - Traineeship,,8,,General,https://www.qualifax.ie/course/113138,1,0,,,2025-01-25T15:00:00,60,"broadcast, general, production, skills, traineeship"
,Bronwyn Conroy Beauty School,,8,,General,https://www.qualifax.ie/providers/bronwyn-conroy-beauty-school,1,0,,,2025-01-25T15:00:00,60,"beauty, bronwyn, conroy, general, school"
,Brook House School,,8,,General,https://www.qualifax.ie/providers/brook-house-school,1,0,,,2025-01-25T15:00:00,60,"brook, general, house, school"
,Broom Sprayer Pesticide Application,,8,,General,https://www.qualifax.ie/course/116352,1,0,,,2025-01-25T15:00:00,60,"application, broom, general, pesticide, sprayer"
,BT Communications Ireland Limited,,8,,General,https://www.qualifax.ie/providers/bt-communications-ireland-limited,1,0,,,2025-01-25T15:00:00,60,"communications, general, ireland, limited"
,Building Capacity & Enhancing Leadership in Intercultural Understanding & Diversity - Carlow,,8,,General,https://www.qualifax.ie/course/109282,1,0,,,2025-01-25T15:00:00,60,"building, capacity, carlow, diversity, enhancing, general, intercultural, leadership, understanding"
,Building Energy Rating Assessment (Dwellings),,8,,General,https://www.qualifax.ie/course/220178,1,0,,,2025-01-25T15:00:00,60,"assessment, building, dwellings, energy, general, rating"
,Building Information Modelling - BIM with REVIT MEP - Online,,8,,General,https://www.qualifax.ie/course/106568,1,0,,,2025-01-25T15:00:00,61,"bim, building, general, information, mep, modelling, online, revit"
,Building Information Modelling - Galway,,8,,General,https://www.qualifax.ie/course/115365,1,0,,,2025-01-25T15:00:00,61,"building, galway, general, information, modelling"
,Building Information Modelling - Galway City,,8,,General,https://www.qualifax.ie/course/116076,1,0,,,2025-01-25T15:00:00,61,"building, city, galway, general, information, modelling"
,Building Information Modelling & Digital AEC - Online,,8,,General,https://www.qualifax.ie/course/111540,1,0,,,2025-01-25T15:00:00,61,"aec, building, digital, general, information, modelling, online"
,Building Information Modelling & Digital Leadership - Galway,,8,,General,https://www.qualifax.ie/course/116110,1,0,,,2025-01-25T15:00:00,61,"building, digital, galway, general, information, leadership, modelling"
,Building Information Modelling BIM & Graphic Illustration,,8,,General,https://www.qualifax.ie/course/112922,1,0,,,2025-01-25T15:00:00,61,"bim, building, general, graphic, illustration, information, modelling"
,Building Information Modelling with Revit Architecture - Online,,8,,General,https://www.qualifax.ie/course/106570,1,0,,,2025-01-25T15:00:00,61,"architecture, building, general, information, modelling, online, revit"
,Building Regulatory Compliance - Waterford,,8,,General,https://www.qualifax.ie/course/115308,1,0,,,2025-01-25T15:00:00,61,"building, compliance, general, regulatory, waterford"
,Building Services with Sustainable Energy,,8,,General,https://www.qualifax.ie/course/113097,1,0,,,2025-01-25T15:00:00,61,"building, energy, general, services, sustainable"
,Building Services with Sustainable Energy - Top Up,,8,,General,https://www.qualifax.ie/course/113100,1,0,,,2025-01-25T15:00:00,61,"building, energy, general, services, sustainable, top"
,Building Surverying,,8,,General,https://www.qualifax.ie/course/104574,1,0,,,2025-01-25T15:00:00,61,"building, general, surverying"
,Building Surveying,,8,,General,https://www.qualifax.ie/course/112464,1,0,,,2025-01-25T15:00:00,61,"building, general, surveying"
,Built Environment - Common Entry - Athlone,,8,,General,https://www.qualifax.ie/course/220975,1,0,,,2025-01-25T15:00:00,62,"athlone, built, common, entry, environment, general"
,Built Environment - Common Entry - Limerick,,8,,General,https://www.qualifax.ie/course/93406,1,0,,,2025-01-25T15:00:00,62,"built, common, entry, environment, general, limerick"
,Built Environment Regulation - Galway,,8,,General,https://www.qualifax.ie/course/112865,1,0,,,2025-01-25T15:00:00,62,"built, environment, galway, general, regulation"
,Buncrana AETC,,8,,General,https://www.qualifax.ie/providers/buncrana-aetc,1,0,,,2025-01-25T15:00:00,62,"aetc, buncrana, general"
,Buncrana YRC,,8,,General,https://www.qualifax.ie/providers/buncrana-yrc,1,0,,,2025-01-25T15:00:00,62,"buncrana, general, yrc"
,Busines with Law - Pre-University,,8,,General,https://www.qualifax.ie/course/113191,1,0,,,2025-01-25T15:00:00,62,"busines, general, law, pre, university"
,Butchering of Beef Pork & Lamb,,8,,General,https://www.qualifax.ie/course/113116,1,0,,,2025-01-25T15:00:00,83,"beef, butchering, general, lamb, pork"
,Cabinteely Community School,,8,,General,https://www.qualifax.ie/providers/cabinteely-community-school,1,0,,,2025-01-25T15:00:00,83,"cabinteely, community, general, school"
,CAD & 3D Modelling - Advanced - Carlow,,8,,General,https://www.qualifax.ie/course/97313,1,0,,,2025-01-25T15:00:00,83,"advanced, cad, carlow, general, modelling"
,CAD & 3D Modelling - Introduction - Carlow,,8,,General,https://www.qualifax.ie/course/97312,1,0,,,2025-01-25T15:00:00,83,"cad, carlow, general, introduction, modelling"
,CAD 2D Level 2,,8,,General,https://www.qualifax.ie/course/109629,1,0,,,2025-01-25T15:00:00,83,"cad, general, level"
,CAD 2D Level 3,,8,,General,https://www.qualifax.ie/course/221702,1,0,,,2025-01-25T15:00:00,83,"cad, general, level"
,CAFRE Enniskillen,,8,,General,https://www.qualifax.ie/providers/cafre-enniskillen,1,0,,,2025-01-25T15:00:00,83,"cafre, enniskillen, general"
,CAFRE Greenmount,,8,,General,https://www.qualifax.ie/providers/cafre-greenmount,1,0,,,2025-01-25T15:00:00,83,"cafre, general, greenmount"
,CAFRE Loughry,,8,,General,https://www.qualifax.ie/providers/cafre-loughry,1,0,,,2025-01-25T15:00:00,83,"cafre, general, loughry"
,CAFRE Open Day (Equine) - Enniskillen Campus (Sat),,8,,General,https://www.qualifax.ie/events/cafre-open-day-equine-enniskillen-campus-sat,1,0,,,2025-01-25T15:00:00,84,"cafre, campus, day, enniskillen, equine, general, open, sat"
,CAFRE Open Day (Horticulture & Floristry) - Greenmount Campus,,8,,General,https://www.qualifax.ie/events/cafre-open-day-horticulture-floristry-greenmount-campus,1,0,,,2025-01-25T15:00:00,84,"cafre, campus, day, floristry, general, greenmount, horticulture, open"
,CAFRE Open Days (Food) - Loughry Campus,,8,,General,https://www.qualifax.ie/events/cafre-open-days-food-loughry-campus,1,0,,,2025-01-25T15:00:00,84,"cafre, campus, days, food, general, loughry, open"
,Calendar of Events File to download,,8,,General,https://www.qualifax.ie/resources/calendar-of-events-file-to-download,1,0,,,2025-01-25T15:00:00,84,"calendar, download, events, file, general"
,CALMAST,,8,,General,https://www.qualifax.ie/providers/calmast,1,0,,,2025-01-25T15:00:00,84,"calmast, general"
,Cancer Genetics & Genomics,,8,,General,https://www.qualifax.ie/course/116370,1,0,,,2025-01-25T15:00:00,84,"cancer, general, genetics, genomics"
,Cancer Survivorship,,8,,General,https://www.qualifax.ie/course/110261,1,0,,,2025-01-25T15:00:00,84,"cancer, general, survivorship"
,Canine Training & Performance,,8,,General,https://www.qualifax.ie/course/219635,1,0,,,2025-01-25T15:00:00,84,"canine, general, performance, training"
,CAO Resource,,8,,General,https://www.qualifax.ie/resources/cao-0,1,0,,,2025-01-25T15:00:00,84,"cao, general, resource"
,CAO 2025 - Round 1 Acceptances Closing Date,,8,,General,https://www.qualifax.ie/events/cao-2025-round-1-acceptances-closing-date,1,0,,,2025-01-25T15:00:00,84,"2025, acceptances, cao, closing, date, general, round"
,CAO 2025 - Round 2 Acceptances Closing Date,,8,,General,https://www.qualifax.ie/events/cao-2025-round-2-acceptances-closing-date,1,0,,,2025-01-25T15:00:00,84,"2025, acceptances, cao, closing, date, general, round"
,CAO 2025 - Round 2 Offers,,8,,General,https://www.qualifax.ie/events/cao-2025-round-2-offers,1,0,,,2025-01-25T15:00:00,84,"2025, cao, general, offers, round"
,CAO 2025 - Round 3 Acceptances Closing Date,,8,,General,https://www.qualifax.ie/events/cao-2025-round-3-acceptances-closing-date,1,0,,,2025-01-25T15:00:00,84,"2025, acceptances, cao, closing, date, general, round"
,CAO 2025 - Round 3 Offers,,8,,General,https://www.qualifax.ie/events/cao-2025-round-3-offers,1,0,,,2025-01-25T15:00:00,84,"2025, cao, general, offers, round"
